id,brand_name,location_city,star_rating,review_text
"bfd06acf-79dc-4901-a5ba-a91d8ae48df0","Removery (Friendswood)","Friendswood","5","Great customer service not pushy, very upfront.   The tech talked me through it did an amazing job. Highly recommend checking the location at  friendwoods out...."
"c984024c-5fcb-457d-8a54-dd82636363b2","Removery (Friendswood)","Friendswood","5","First treatment down and was painless. Deshaun explained everything and was very gentle. Can’t wait for my next session."
"c387e40f-1f16-4343-aa5b-6525c2e87632","Removery (Friendswood)","Friendswood","5","Fourth treatment. Slow and steady wins the race. If anyone is thinking you're going to come in and get a tattoo removed in one session, you need to do more research. Staff is knowledgeable. Yes it hurts worse than getting the tattoo. The tattoo is starting to break up and get removed by my lymphatic system."
"b36e8e92-5c44-412f-bfd3-ba196e3d9583","Removery (Friendswood)","Friendswood","5","Lovely atmosphere.  Just two forms to fill out and pricing is feasible. Great experience."
"9b079602-6f7b-4221-be3d-1289a64ce410","Removery (Friendswood)","Friendswood","5","Hi! Just want to share my great experience with DeShawn of Removery Friendswood. I love working with DeShawn. For the couple of times I’ve been to the office regarding my tattoo removal, He always provides A1 customer service, makes me feel comfortable and at ease and answered all my questions.  Deshawn is great at what he does!"
"b1991720-0e82-4ebe-a4d6-2cd2421dd2b4","Removery (Friendswood)","Friendswood","5","Destany and Deshawn are awesome! I’ve been to another location before, but they make this place feel so comforting and definitely making this my home store. Great atmosphere and vibes and always super quick service!"
"97cbfe58-1b4a-4bb2-8fe3-ebc27a3e0286","Removery (Friendswood)","Friendswood","5","Deshawn is a great technician and always makes the appointment as comfortable as possible"
"ea0972b3-5076-4c7e-881d-732eed96e594","Removery (Friendswood)","Friendswood","5","DeShawn is most patient! He plays cool jams during your session which is helpful, puts you at ease. They are on top of scheduling your next session, most professional, I highly recommend."
"2ac72bfa-88f4-4309-b2be-99a7cf3e6ef1","Removery (Friendswood)","Friendswood","2","Very knowledgeable and good environment.... UPDATE: I went to Jess for over a year.  She is very knowledgeable.  I went in for my appointment 15mins late.  Instead of canceling and/or rescheduling I believe she purposely burned me. The reason I believe this is because she didn't say one word to me until after the short procedure, which is unusual.  I could also tell that she was annoyed that I was late because she kept looking out of the front window.  (Unfortunately, I was dealing with a serious family matter over the phone) I would have totally understood if she had to cancel my appointment!  As I was leaving she sarcastically told me to have a nice day.
I reached out to the company and the general manager was helpful.  They said there was an investigation but they could not give me details.  I now have to drive to channelview once my finger heals to finish getting my tattoo removed.  Just be careful in choosing who you allow to use a laser on you.  And if you are late with Jess at the Webster location, just reschedule regardless if they let you in or not. This is a picture over a month after being burned.."
"a0e56435-59d8-4e42-acaa-e3f3a6c6bf75","Removery (Friendswood)","Friendswood","5","Deshawn and Destiney are amazing! They both build great rapport with their clients and are extremely knowledgeable on tattoo removal. The process is fast and Deshawn talks you through it keeping you calm during the process. Thank you both! 🫶🏼🥰"
"26395307-d209-4508-9f4d-f38f7a40904d","Removery (Friendswood)","Friendswood","5","I’ve been coming here for tattoo removal and I truly love this place! Destany at the front desk is always so bubbly  and I mean always. She’s incredibly nice, welcoming, and makes you feel comfortable the moment you walk through the door. Her energy really sets the tone for the whole visit.

Deshawn, the tattoo removal technician, is amazing at what he does. He’s always on it and gets you in and out efficiently, but you never feel rushed. The way he moves the tattoo removal machine, you can tell he knows his job from front to back, especially when working around detailed lines.

He’s quiet at first, but once you start talking to him especially about his family  you can tell he’s such a genuine family man who really loves his kids. It just shows the kind of heart he has. He’s very nice, professional, and makes you feel comfortable throughout the entire process.

I also really appreciate that he puts safety first every time making sure you have your protective glasses on, using ice packs, and checking in to make sure you’re okay.

The whole experience is smooth, professional, and welcoming every single visit. I highly recommend them to anyone considering tattoo removal!"
"15b6d497-6518-4f7c-b2fe-91f50a02786f","Removery (Friendswood)","Friendswood","5","So great, went in for consultation and ended up getting my first session 20 minutes later!"
"f9599c31-2cdd-4117-a51b-1f8350d0c13c","Removery (Friendswood)","Friendswood","5","I always have such a good experience when I come for my treatments ! I love a good chit chat when I first walk in & DeShawn is great through out the process once in the actual room. Good vibes always & it makes the experience a lot easier !!"
"f1464e6d-7d46-4787-a7db-f3b5db285f41","Removery (Friendswood)","Friendswood","5","Love this location! The staff here are very friendly and helpful. Overall having tattoos removed takes a lot of time, but the staff here make the process so much better!"
"0c3844a8-fbe7-4fc6-b757-ffc7f8f202af","Removery (Friendswood)","Friendswood","5","My first time at this Location. It was a great experience. DaShawn was my technician and he was professional and kind. The sweet girl at the front desk was also very nice and helpful."
"c5fe1208-9513-4cc1-9889-d88fead04e41","Removery (Friendswood)","Friendswood","5","Awesome customers service. The staff is very friendly and welcoming!"
"258f325d-f5e6-45e8-9ee7-51552053e99c","Removery (Friendswood)","Friendswood","5","Fast and easy process! Friendly staff and great service! Definitely recommend!"
"4f0d00d4-9ab2-4de1-9e23-2a417592b410","Removery (Friendswood)","Friendswood","5","Honestly… tattoo removal terrified me. I just finished my fourth session. The anticipation beforehand never gets easier but it helps a lot walking in to a technician who knows what they’re doing. DeShawn is very informative on the process and provides good tips and also knows how to make the process beforehand easy. From icing correctly, letting you take breaks when needed, and talking you through the painful moments (keep breathing, etc). He knows what he’s doing and I am grateful to have a great studio near me and a reverent technician as well. I must say, the Removery crew has been very helpful and they do use the best lasers. My tattoo healing process has been crazy, but beautiful. Thank you, Removery."
"9a534c3c-861b-454d-a6de-daa99f8f16f9","Removery (Friendswood)","Friendswood","5","Came in with my husband to get a removal in order to enlist in the military and Destani immediately assisted me. She was very sweet and informative and answered every question we had. We were able to get in right after signing paperwork and start the sessions! Deshawn was amazing, very reassuring and his area was clean and well organized while the ambiance was relaxing! He was amazing!"
"fe5c1c63-5f49-4bcc-8444-340b9c94de55","Removery (Friendswood)","Friendswood","5","Deshawn and Destani were awesome, the treatment was quick and easy, wasn’t painful at all!"
"80fd4de0-e771-4ab4-909a-f237f3e9f878","Removery (Friendswood)","Friendswood","5","Great atmosphere and caring professionals"
"ee2aca58-c120-4c05-a481-2dc19e9f35c0","Removery (Friendswood)","Friendswood","5","If you are considering tattoo removal I highly recommend this location! The staff are amazing, extremely helpful and talk everything over with you so you feel comfortable. My tattoo is looking amazing, so excited to finally have it gone. Thank you so much!"
"4ad463c7-928a-42ea-841d-af4776c97d01","Removery (Friendswood)","Friendswood","5","Deshawn was wonderful!"
"78e1fe66-136f-4dd2-959d-e848ee366bc8","Removery (Friendswood)","Friendswood","5","Awesome and fun environment that really makes you feel at ease. DeShawn is incredible and provides an explanation for everything he does and takes his time answering any/all questions."
"1f519de0-1127-4c43-8db9-2b8777794e55","Removery (Friendswood)","Friendswood","5","Quick service, nice people and very.informative consultation process."
"79ebbaef-93e4-404b-92f2-b55937cd0fd1","Removery (Friendswood)","Friendswood","5","So far so good. I went in for a consult, and didn't expect much more than that. They worked with me on a payment plan, and I started the removal process. It wasn't near a painful as I had heard. It will be well worth the pain and price to be ride of something that reminds me of a very bad time in my life.
This location is nice, clean, and they treated me well. Friendly, understanding, and quick."
"746b28d5-3464-41ea-a1d6-23c403a6acb1","Removery (Friendswood)","Friendswood","5","Very friendly staff!! The office is clean and well organized. I arrived feeling very nervous, and the tech Deshawn helped me feel comfortable and explained every step along the way."
"e81ec38c-6c4c-4acb-8831-4c60f4bfcfba","Removery (Friendswood)","Friendswood","5","Thanks fast keep doing a great job"
"d2730bae-d67d-409b-9d74-a7410fd1eba0","Removery (Friendswood)","Friendswood","5","Second time visiting for treatment and they have excellent service"
"8772a790-54db-435c-a9a7-993a19d22e19","Removery (Friendswood)","Friendswood","5","I have had these ugly birds on the backs of my arms for 15+ years and I’m so self conscious about them. I’ve gone the saline injection route to remove them in the past but never finished. Made an appointment yesterday for a consultation today, walked out less than an hour later with no birds on my arms. Destiny was so great. She explained everything so well and I really had no concerns going into it. DeShawn was just as amazing. He walked me through the whole process and explained the how and the why. Once I made up my mind, he said “let’s do it now!” Which I fully intended to procrastinate and put it off for another 3 months.lol I’m grateful I made this appointment today and so relieved to see results so fast. Their studio is clean, warm and welcoming. Thank you!!!"
"de93511c-7a66-473c-8516-d8da54d4ee61","Removery (Friendswood)","Friendswood","5","If you are considering tattoo removal, I recommend this location as I’ve been a client for several years. I have several tattoos that are in the removal process. They’ve already successfully removed one as if it never existed. Deshawn is an amazing technician. He also has an awesome playlist of music and mentally that helps haha He walks you through every appointment step by step. He is professional and knowledgeable. Tattoo removal is definitely a journey and I am so grateful for the level of service and care at this location."
"9d2fa97f-509d-4cc3-9339-11d928b94c0e","Removery (Sugar Land)","Sugar Land","5","My experience was actually quick & overall the pain was not as bad as I thought it would be . Highly recommend def worth the results"
"11d3fb89-89a4-433e-a7fa-ad14661d78cd","Removery (Sugar Land)","Sugar Land","5","Great place to get your tattoos removed. Great staff and very professional."
"c27c25cc-494e-4272-9b45-630f452070d1","Removery (Sugar Land)","Sugar Land","5","Staff at Sugar Land location is extremely knowledgeable and helpful throughout the process. Great service."
"fe65f650-88d2-4774-9e3e-d672b6976678","Removery (Sugar Land)","Sugar Land","5","Such an amazing opportunity to come across a very put together location with very nice people and the process is as smooth as possible thank you so much removery ❤️"
"b419773b-a09c-4f7e-b01a-420db035ec2d","Removery (Sugar Land)","Sugar Land","5","So far the treatment has been great. The tattoo is fading and I have had no skin issues with my sensitive skin during the treatment. The ladies in the office are very sweet and easy to work with."
"52c98df8-26ec-4412-988b-28c7506e47f0","Removery (Sugar Land)","Sugar Land","5","Super friendly. Would recommend."
"2bc3e426-b62f-4d44-8c27-873aa59393b2","Removery (Sugar Land)","Sugar Land","5","LOVE IT HERE THEY DO AN AMAZING JOB! Ive been doing my sessions for about a year now and I’m obsessed! Everyone is knowledgeable and will not steer you wrong!"
"f524af93-8beb-4479-8529-732b65c168ca","Removery (Sugar Land)","Sugar Land","2","I got their services 2 1/2 years ago.  I only  had 4 session back then the technician who did my sessions was phenomenal and the place seemed really busy at the time.  I was given a discount for my first 3 package price.  However, today, 2 1/2 years later I went back to the same Sugar Land location and was really disappointed.  Let me just say that I had called their 1-888 number and they tried to get ahold of someone at this location because I had questions about their pricing, etc.  They couldn't reach anyone and told me someone would call me back.  Well after and hour I still didn't hear back from anyone.  So I drove over to the physical location.  A Jasmine/Yasmine? was at the front desk, and the place was completely empty, no clients, no busy servicing, her phone didn't ring once while I was there, and she was completely lacking in any initiative to help me with trying to figure out about any discounts available for a returning customer and it was like pulling teeth trying to find out pricing from her.  She seemed bored with me, like I was just an annoyance.  When I asked if the same tech was there that worked on me over 2 years ago, she said no before I ever gave a name.  Then she proceeded to tell me that they had a complete change over of ALL personnel including the regional manager.  When I said, boy it seems slow today, she said ""no, we are actually very busy and have a ton of clients"".  Well, I saw none..LOL  Anyway, it was really a turn off and I decided to leave and go somewhere else.  As a potential customer I want someone excited to tell me about their services and costs, even if I am a returning customer.  I want someone to be excited that I walked through the door.  But what I got was a very ho hum, I am bored with you customer treatment.  I loved this place 2 1/2 years ago, but not today years later.  One other thing, she said their were zero discounts or special offers.  When I went down the street to one of their competitors I got an amazing discount on a 10 session package and was treated like they were excited I walked through the door and were anxious to show off their place and tell me about all their services and products.  Sorry Removery but you lost me as a customer for offering no discounts to a returning customer and lacking any enthusiasm or showing initiative to gain me as a customer."
"60e65641-6595-4c56-882f-3914ff74331f","Removery (Sugar Land)","Sugar Land","5","I had a really great experience at this tattoo removal clinic. The staff was very professional, kind, and made me feel comfortable throughout the entire process. I was honestly expecting the pain to be much worse, but it was very manageable and not as bad as I thought it would be.

They took the time to explain everything to me, answer all my questions, and made sure I felt at ease before starting. You can tell they really care about their clients and do quality work.

I’m very happy with my results so far and would definitely recommend them to anyone considering tattoo removal!"
"f4fecadc-af4d-4119-9609-059f561ca70f","Removery (Sugar Land)","Sugar Land","5","From the jump, the whole staff was super informative and helpful with all my questions.

Gave me re assurance and multiple options to chose from including good finance options as a veteran. Very affordable if you’re serious about removing a tattoo.

6 sessions in so far and there’s definitely good results. Thank you removery!"
"6245fb29-723b-4c1d-808b-09ac16ff19c1","Removery (Sugar Land)","Sugar Land","5","Very welcoming place. Both of the ladies are amazing. My tattoo removal tech makes everything go smooth."
"89286f16-83da-44a8-8ef1-d8dff7ae52cb","Removery (Sugar Land)","Sugar Land","5","The ladies at the Sugar Land location are lovely. Great experience."
"7e271dc1-eda0-47a0-8ef1-2a8eaab5a741","Removery (Sugar Land)","Sugar Land","5","I had such an amazing experience at Removery today! I officially started my tattoo removal journey on multiple tattoos (both hands, foot, and two name tattoos), and I couldn’t be happier with my decision.

Yasmeen and Ashley were absolutely incredible. They were so kind, patient, and professional from the moment I walked in. They explained everything clearly, answered all of my questions, and made me feel completely comfortable and supported. The treatment itself was much more manageable than I expected, and they constantly checked in to make sure I was okay.

What really made this experience even better was how transparent and helpful they were with pricing and financing. I was able to get an unlimited session package with 0% interest, which made such a big difference and gave me peace of mind knowing I can continue treatments until everything is fully gone.

This was such a meaningful step for me, and I’m truly grateful for how smooth and positive they made the entire process. I highly recommend Removery and especially Yasmeen and Ashley
to anyone considering tattoo removal!"
"b56ca1b9-08c1-49f5-8f90-cd3b03a96847","Removery (Sugar Land)","Sugar Land","5","Great staff and great service."
"ae4f081c-8c96-4857-9b2a-6189abade387","Removery (Sugar Land)","Sugar Land","5","Booked my consultation appointment online. Came in and filled out a few quick forms.

Yasmeen then spent over 30 minutes explaining the whole process, showed me examples of what to expect, and answered all my questions. I mentioned that I’ll be moving out of state soon, and she reassured me that all of my information and services transfers seamlessly to all their other locations.

Once I made the decision, I went next door for my first session with Ashley. She made sure I was comfortable and let me know exactly what to expect for my very first session. Just minutes later, I was leaving! In total I was there for 1 hour and 15 minutes (from filling out forms, to initial consultation, to treatment).

Both Yasmeen and Ashley explained everything thoroughly, step by step, without ever making me feel rushed. The whole experience felt professional, transparent, and genuine. Highly recommend!"
"9b1ddc0e-ac6a-4a05-9a6f-a4e41ca2b4a4","Removery (Sugar Land)","Sugar Land","5","I’ve been coming to Removery for about a year and a half now for tattoo removal, and the results have been incredible. I have a large tattoo on my lower back, and I’ve seen so much improvement over time.

My current technician is absolutely amazing — professional, knowledgeable, patient, and genuinely caring. She always makes me feel comfortable and confident throughout the process. The consistency and care she brings to each session really shows in the results.

I truly love this place and highly recommend it to anyone considering tattoo removal."
"8b69d770-3233-41bf-9ac0-afe1ee9dd8dc","Removery (Sugar Land)","Sugar Land","5","Such a professional office, very well explained. Answered all my questions. From front of the clinic to back everyone was very patient and professional. Love their energy!"
"6d87bb2b-ded8-4394-8fe8-782f13423efb","Removery (Sugar Land)","Sugar Land","5","So thorough with the process and definitely made me feel more at ease ! Already seeing progress on one of my smaller tattoos."
"35dee981-153c-430b-9497-969fdfadf07e","Removery (Sugar Land)","Sugar Land","5","Buenos resultados hasta el momento tengo 5 secciones y todo va muy bien las chicas son geniales"
"cc912595-34f1-4bc5-9e8e-166d9f8726ba","Removery (Sugar Land)","Sugar Land","5","I have been going to Removery for a while now. When I first started my treatments I was a little nervous because I always heard the pain was worse than getting a tattoo. I just finished my 6th treatment and I will say the staff is kind and makes me feel as comfortable as possible. The appointment scheduling is accommodating. I see major results with my treatments. I would definitely recommend this place to anyone looking for tattoo removal."
"f14bb39a-61c5-4f96-8828-a54da879d076","Removery (Sugar Land)","Sugar Land","5","I went in for a consultation, and actually started my 1st treatment the same day. Everyone was very professional and friendly.  Everything was explained in detail, and all of my questions were answered fully. I was very pleased with my visit."
"9f2f4426-28bf-462e-9a9c-670c9fc7bcc2","Removery (Sugar Land)","Sugar Land","5","Best studio for tattoo removal ✨"
"4b5100c6-fb2f-4069-9dda-1ae158ec85f8","Removery (Sugar Land)","Sugar Land","5","Thanks!!! Always great service always very clean and professional environment"
"15ccb5f9-be41-4e5c-b5a6-aa57bd3b2ab5","Removery (Sugar Land)","Sugar Land","5","Ashley does a good job with my lasering and care within the process. My project is a challenge but im seeing a big difference  with patience  and endurance.  Thank you sm 🙏✨️🖤"
"b41bd8a8-c48d-4fa9-8312-1ceb9b0ecb7d","Removery (Sugar Land)","Sugar Land","5","Ashley is always incredibly pleasant and welcoming every time I come in for my laser treatment. She takes great care to ensure the ice has done its job before we begin, which makes the experience much more comfortable. She's very informative and always takes the time to explain things clearly. I genuinely enjoy seeing Ashley at all my appointments—her professionalism and warmth make a big difference!"
"10cca594-ba82-421d-8296-7cb8498f1b9f","Removery (Sugar Land)","Sugar Land","5","i’ve been going to Removery for over a year now and Ashley has been amazing every session. She’s polite, knows what’s she’s doing and is a very well communicator!"
"9b9a6036-5372-4aab-80e5-33f968e6126c","Removery (Sugar Land)","Sugar Land","5","I had my first laser tattoo removal session yesterday, and Ashley was amazing! She explained everything clearly, checked in on me throughout the process, and made sure I was completely comfortable. Her professionalism and kindness really put me at ease. Highly recommend Ashley if you’re considering tattoo removal!"
"8256ab4c-7068-4e30-ba9c-d2f47460eac2","Removery (Sugar Land)","Sugar Land","5","I ALWAYS have a good experience when I come for my appointments/treatments The staff is very helpful, caring,, knowledgeable and professional . My husband says he can see a difference!"
"40858e3f-2032-4c8b-afb2-14d5f956528b","Removery (Sugar Land)","Sugar Land","5","Ms. Yessmen who helped us is super terrific she was able to explain everything and walk us through the process very easily. She’s super wonderful!"
"98a7e315-b758-4007-9a8e-c9ab596babde","Removery (Sugar Land)","Sugar Land","5","I just had my first session at removery and I was WAY more scared than I was letting on. I was very anxious about the whole experience. Yasmeen and the laser tech made me feel super comfortable and they even helped me convince my boyfriend to be my emotional support during my first session. I look forward to continuing to work with them on this. Thanks!"
"50e1d4f5-f77a-4b09-b07a-1ebe3a959f24","Removery (Sugar Land)","Sugar Land","5","I highly recommend this place for transparent communication, reliable results, and very friendly staff! Both Yasmeen and Ashley were fantastic to deal with and took their time to run through the whole procedure, answering any questions I had along the way. The pricing was actually way better I expected and they do have some great financing options. The sensation is a little like getting popped with hot grease or a static shock, but if you can sit through a tattoo you can sit through this . I've only had one session so far but I can already see some of the ink breaking down. I'm excited to see how the results progress with more sessions. Really great experience! 10/10 for staff!"
"7fa14c67-ddb1-443c-bc81-10e40ba7eb2e","Removery (Sugar Land)","Sugar Land","5","The staff had me feeling very comfortable once expressing my concerns! I really appreciate their help and I look forward to the removal of my tattoo."
"fd96b4e7-99eb-4be1-9b38-4da324dc8576","Removery (Sugar Land)","Sugar Land","5","Very informative for a first visit. Can’t wait to see my results."
"cc579dcc-ef62-4c1e-8459-0b5481721cb0","Removery (Sugar Land)","Sugar Land","5","Thank You all, all do an awesome job, and I will definitely send you people who are interested in getting there tattoo removed. And again thank you for all you do."
"f4aee14c-41d2-48eb-90e4-dbcea39cfa45","Removery (Sugar Land)","Sugar Land","5","Great consultation and staff. Very informative and thorough about the whole process. Look forward to using them for my treatment."
"5a2e5d81-f94e-4ce4-a009-13d33a6f501b","Removery (Sugar Land)","Sugar Land","5","Great service ashley n is a great tech she help me olot with my removal!!"
"46fd61fa-d3a0-4f46-96ae-99987d4a05c1","Removery (Sugar Land)","Sugar Land","5","Best experience. Consultation was excellent with Jasmine and Ashley did the removal tattooing on my brows and was awesome. I highly recommend.
Susan"
"24eecf64-eff6-4891-b6ba-7ab99c1dd442","Removery (The Woodlands)","Shenandoah","5","Amanda is so thoughtful and patient. She comforts me when I need it. We work together to figure out the best way to go about each treatment."
