id,brand_name,location_city,star_rating,review_text
"241d697f-3730-4095-8634-70678a3c8e56","Removery (Round Rock)","Round Rock","5","Really great experience with my tattoo removal. The staff is super friendly and makes me feel comfortable the whole time. Everything is clean, quick, and well explained. Definitely recommend!"
"94bb6796-6d29-4bb1-b152-d2b2cf7d0617","Removery (Round Rock)","Round Rock","5","The people there are very friendly and remember conversations that I have with them."
"641228c2-34a4-43ac-bd4a-e936acc47c68","Removery (Round Rock)","Round Rock","5","Every time I come in for my scheduled appointment, I don't have a long wait to be seen. My tech is the best. She is very friendly and makes the experience easy to forget about the pain."
"691e373b-542d-43fe-a192-4ebb6da54e04","Removery (Round Rock)","Round Rock","5","Audri and Tina are awesome. The second i walked in the door, they were welcoming, took time to educate me, share her personal experiences with me and made me feel very comfortable about being a Removery client. Would highly recommend"
"7ac19596-edff-43cc-8027-e0b689dfe108","Removery (Round Rock)","Round Rock","5","Tina has been awesome every visit: very friendly, professional, and gets me through the treatment quickly. The location is very clean and welcoming. I highly recommend for your tattoo removal needs!"
"8678aa73-ec36-4d8c-887e-3dddf59ecdc8","Removery (Round Rock)","Round Rock","5","New update: progress is going extremely well. I cant recommend this place enough. The staff is so warm and welcoming and im truly glad im doing this for myself instead of waiting longer.

Update!! I've done 3 sessions so far and the results are definitely showing. I have a large chest piece tattoo and a tattoo on my arm and im so glad I decided to get them removed.

Audrey was so sweet and helpful. I'm glad I was able to find this place. I can't wait to get my sessions done."
"4bab8451-3783-48b7-8aff-49d6a199b747","Removery (Round Rock)","Round Rock","5","Absolutely love this location! They are knowledgeable, kind and will be honest about every step you need to take. I highly recommend Removery - Round Rock!"
"fec42e1a-7f04-4bc1-a09f-3d2a60812856","Removery (Round Rock)","Round Rock","5","Give this awesome 👍😎👍 place a chance. They do things the right way with the removal of tattoos. I am in my 3rd session and each session is done with presice care and updated equipment."
"7e5f8e6c-aff0-4d02-b8ae-19595b5e9f37","Removery (Round Rock)","Round Rock","5","Amazing experience 10/10"
"393353ba-dee3-4030-a13f-b273474d6729","Removery (Round Rock)","Round Rock","5","I didn’t know what to expect from removing. The staff was friendly,, and willing to answer all of my questions. They did a great job and my eyebrow tattoos are completely gone afte The first session. I’d like to give a shout out to Tina, Amelia, and Audrey, the brow Wizard, for a job super well done."
"6cc0cb31-c659-4176-a334-f872e6fc02f5","Removery (Round Rock)","Round Rock","5","I called today to see if we could make my appointment sooner, today, if possible and without hesitation I was rescheduled for a couple of hours after the phone call for today. Polite, courteous , and professional per usual, always know my name when I walk in and got me in and out. 10/10 would recommend the Round Rock, TX location specifically due to the staff themselves."
"bbe23cb5-e281-44d5-abb5-a3df6210ebb8","Removery (Round Rock)","Round Rock","5","I always look forward to seeing Audri and Tina. My tattoos are almost gone  and I have Tina to thank. I’ve seen the most results with her vs other locations. They are highly skilled at this work."
"ab5e5075-084e-4315-8651-e031afda0851","Removery (Round Rock)","Round Rock","5","Single-handedly the best customer service I’ve ever received"
"84b50a8a-2f6a-4373-8e22-a5f3f1cabe42","Removery (Round Rock)","Round Rock","5","The staff is very professional and makes me feel comfortable.  My  husband was so surprised at the progress made..  it almost wants me to get another tattoo because they are sooo good."
"c1a2b424-1565-4798-8292-96ea95e82e4c","Removery (Round Rock)","Round Rock","5","Super friendly staff. Very welcoming. Amelia was both personal and professional."
"4f2df978-4ed4-44a5-b3d0-7cb0979c95e0","Removery (Round Rock)","Round Rock","5","My first session was a breeze! Audri was awesome and I enjoyed our chat while getting zapped. Look forward to my next session!"
"4e651f75-5fc9-472e-aab5-92cc6f8d5541","Removery (Round Rock)","Round Rock","5","Everyone is Friendly and very professional.  Very clean!!!"
"95a4ccf3-f1c8-4aee-bb24-2bb755d88926","Removery (Round Rock)","Round Rock","5","Always a great experience at Removery Round Rock. Amilia, Tina and Audri are always such a pleasure and so welcoming!"
"140753ad-f30c-4e00-977a-149c56963cfa","Removery (Round Rock)","Round Rock","5","Great experience! The Round Rock location staff was attentive, kind, and provided excellent customer service. I’d definitely recommend! Thanks you ladies for the service you all provide."
"db21d70c-3fdf-4644-afc5-8d4f8cc549ec","Removery (Round Rock)","Round Rock","5","I had a great first experience they were able to do same day when I only had a conference scheduled it was so fast! All the staff were so kind"
"00dc6651-df9e-4e0c-b25d-2114aea02e2c","Removery (Round Rock)","Round Rock","5","We love Removery staff!! We highly recommend and always have the best experience!"
"1e29179f-0ab1-4e78-9f40-40f9f0839809","Removery (Round Rock)","Round Rock","5","Very friendly staff and a very clean facility."
"9f3e707f-7da8-4bec-b151-dc73dbb844c6","Removery (Round Rock)","Round Rock","5","I have been going here for a while now removing one of my tattoos. The girls are all so nice and lovely, always send me reminders for everything, and are great about scheduling."
"5bdba3c8-5f12-4691-9279-aaa065398ef9","Removery (Round Rock)","Round Rock","5","Excelente atención recomendado 100%"
"a56a8a7f-197c-4a4c-bc7d-0028ccec9f6b","Removery (Round Rock)","Round Rock","5","I am so happy with the  progress with my tattoo removal.  Everyone is super friendly and professional.  I get my appointments scheduled promptly.  All the work is documented.  Place is clean.  I appreciate all the details the staff put in to make it a great experience every time."
"91b7db12-d84f-4cd1-8bf4-b7898e1502a7","Removery (Round Rock)","Round Rock","5","Amazing experience! The staff were really friendly, able to take me in on the same day of my consultation, and they lasered everything off in one sitting. It was painless!"
"506ca169-af4d-4398-80d1-1a79cbe77634","Removery (Round Rock)","Round Rock","5","I have had 3 sessions so far and everytime I’ve had a great experience. They really do a good job at explaining to you how the procedure will go and making sure you’re comfortable during the laser treatment. So excited to see my tattoos disappear, even just 3 sessions in my small fine line red one seems to be almost gone !"
"87bcacee-6759-4b86-ba27-d25a15e80a66","Removery (Round Rock)","Round Rock","5","Really good service, friendly and quick!"
"f55f31e2-c9a5-4362-acc4-693d395a4e8b","Removery (Round Rock)","Round Rock","5","I had a great experience going in for my first treatment at Removery in Round Rock! Audri is so kind, knowledgeable, and efficient. Amilia and Tina are wonderful as well 😊. The clinic is also very clean and relaxing. Can’t wait for my next appointment. Thank you ladies!"
"0bca3878-0fcb-4ac4-bd9b-71997aa61e55","Removery (Round Rock)","Round Rock","5","The team has been so welcoming and made this process an easy decision. The guidance and care the team has offered has made me extremely comfortable. I had my first session on Saturday, it was easy, mostly painless, and quick. I’m excited to see the progress over the next several months."
"26c4849f-1f56-43b4-88ed-8e73b224d834","Removery (Round Rock)","Round Rock","5","Highly recommend, friendly staff, makes you feel very comfortable. Just go and get it done, finally."
"91dab35d-91fb-4931-82ce-0ddf8aa7c4f9","Removery (Round Rock)","Round Rock","5","Amilia was very helpful and answered every question I had"
"dab1804f-8a44-4b21-9375-d8cbcb45194f","Removery (Round Rock)","Round Rock","5","I love removery in round Rock Tx!!! They are always so sweet!! I have really noticed a difference in my tattoo removal process.  And will always recommend them to anyone!!"
"ac09645d-9fbb-4f71-9715-93f8e9e194a2","Removery (Round Rock)","Round Rock","5","It was quick & easy. I am honestly satisfied with the first session results. Super excited!!!"
"09dceeba-a4ad-4db7-9410-2f60a318bf0a","Removery (Round Rock)","Round Rock","5","Always a good experience and I’ve been going for a long time.  Great customer service!"
"fa9ffbb9-6b4f-4616-b356-2a3e3c71bad5","Removery (Round Rock)","Round Rock","5","The staff are so friendly and professional. They take good care of me. They always ask about how my results are after the treatment. The staff always remind me of the treatment I should give to the area that was treated. Today the treatment seemed to go by very fast. My removal is almost complete and they were very dark and full of different colors."
"d6177ebd-89dc-45d4-a33e-1b8d46233435","Removery (Round Rock)","Round Rock","5","First of all, the nicest employees. Price wise, still cheaper than my student loans as thats the only price comparison that I can make. I'd like to say I learned my lesson with last minute cheap tattoos 👍"
"30f222e2-9844-48c7-a394-55b7a57fa045","Removery (Round Rock)","Round Rock","5","Extremely nervous about the tattoo removal process… Removery was amazing and explained the entire process from the beginning to the after care. Extremely quick and honestly was almost painless. Process felt like a hot rubber band snapping against the skin. Afterwards the pain was minimal and would compare to a sunburn."
"7ae0867f-f6b0-4544-9ece-6f5297e5f5db","Removery (Round Rock)","Round Rock","5","Tina is awesome!! She truly cares about her clients and makes them feel completely comfortable with the process."
"ad74bb51-6994-42be-b5de-bcd05690f345","Removery (Round Rock)","Round Rock","5","These ladies are amazing! Super kind, efficient and work well together and on my background for scheduling. It’s been a great experience. I’m almost there!"
"16ca9fbc-b771-400d-9cc2-332a6bea9ceb","Removery (Round Rock)","Round Rock","5","They are amazing! Removal of any and all tattoos is truly possible."
"2eef1bb9-b402-448e-b9b0-56bb41b3d6eb","Removery (Round Rock)","Round Rock","5","I’ve been coming to Removery Round Rock for several years for tattoo removal and have had such a great experience. Amilia, Tina, and Audri are always incredibly professional, knowledgeable, and kind. They make what could be an uncomfortable process feel easy and supportive, and they always take the time to explain everything and make sure I’m comfortable. The studio is clean, efficient, and very welcoming. I truly appreciate the care they put into their work and would absolutely recommend them to anyone considering tattoo removal."
"cb24e1a2-6f13-4bff-8f22-949afd0610ee","Removery (Katy)","Katy","5","Zara and Jerry are very professional and nice. I got my first session the same day as my consultation.
Tyler did my last session.  She was awsome!   She asked me if I needed any breaks while my laser session was going on and I told her no, But she gave me a little break anyway and I was really glad about that. She is very friendly and professional.  My tattoo that I am removing has lightened up alot.
I would definitely recommend Tyler to anyone for tattoo removal.
I had another tattoo removal session today. I'm so grateful for Tyler numbing my lower back with ice packs before  starting the session. Its over quickly! I can tell Tyler is very experienced and well trained. She always checks with me throughout the process to make sure im doing ok and she's OK with stopping if I need a break. When the service is over she goes over after-care instructions. My tattoo has lightened up alot! I'm so happy about that! This service is safe, quick and it works.
_________________________________________
UPDATE:
TREATMENTS ARE GOING VERY WELL. MY TATTOO IS ALMOST, COMPLETELY GONE! YAY! KIRSTEN, AMANDA AND DANIELLE ARE FRIENDLY, AMAZING AND VERY KNOWLEDGEABLE. They take the time to answer questions and even check with me to make sure I'm healing well and remind me of aftercare dos and don't. They are very professional and caring. Kirsten did my last procedure. She did a great job!"
"cca87cb9-9e53-4a32-a9fb-1ff36d4f48b4","Removery (Katy)","Katy","5","great location! I've been to a few others and this is the best. really great customer service and experienced technicians."
"9ecc893e-d6bb-4ed5-8b3a-44f539709f34","Removery (Katy)","Katy","5","Great customer service so far. Process is going well.
Always on point."
"5a6988a3-b740-4ac7-a1df-cf25286cbbb3","Removery (Katy)","Katy","5","Highly recommend this location , all staff are very friendly and caring.  They always check on my to make sure everything is okay and if I have any questions or concerns.   Treatments are always quick !"
"69c889f4-c27d-425e-b485-2ebb3e3907c8","Removery (Katy)","Katy","5","So happy to be seeing amazing results already! The staff at the Katy Removery location are very knowledgeable, professional, and kind. They help to make this painful process as pleasant as possible."
"b3f71cb8-4691-4584-9d6e-c2d11a280cb4","Removery (Katy)","Katy","5","Best team  . Kirsten is the goat !!"
"b1ea384d-52d5-472c-a2d9-6228f9afe165","Removery (Katy)","Katy","5","In and out. Very talented work staff! Respectful and professional. Process is super easy! Second session done and already seeing great results! -Jon"
"8fc277d0-4180-4bb5-b7ea-1fb36f99f6ae","Removery (Katy)","Katy","5","Thank you Removery, so far the process has been smooth. Thank you to the staff as well! Highly recommend for anyone looking into tattoo removal"
"12390a7d-937f-46f5-8f4d-08f781d838ec","Removery (Katy)","Katy","5","Danielle, Kirsten, and Amanda were all amazing. They were very friendly and even checked in on me after my appointment, which was so thoughtful.

They showed me photos of people with my same skin tone who had tattoos in a similar area and their results. That made me feel really confident moving forward. I also got a 15 percent off deal for full tattoo removal with unlimited sessions, so I had to take it.

I plan to keep going until my tattoo is completely gone. I will post before and after photos next year around this time, or share progress updates along the way. I went in for a consultation on 4/11 and they were able to start my treatment the same day. Best decision I have made.

Kirsten is doing my treatments. She is very kind and made sure I felt comfortable the whole time. She held an ice pack on my tattoo to help numb the area before starting and took her time, which helped me relax. During the laser removal process, she blew cold air through a tube onto the area, which really helped reduce the pain.

I am so glad I chose Removery after wanting this tattoo gone for so many years!! ♥️"
"4a327530-7224-494f-925d-ba977a2233ea","Removery (Katy)","Katy","5","Excellent staff. Knowledgeable, friendly and professional. Thank you Removery Tattoo Removal of Houston, TX!!"
"a2a26cec-8f1a-4a05-9d93-eea668f7f30f","Removery (Katy)","Katy","5","The staff was very friendly and informative"
"746fad72-f952-429a-bb29-8c057dfa0912","Removery (Katy)","Katy","5","The girls at Removery were so kind and informative. I felt confident and comfortable throughout the quote process and went straight into my first treatment. Can’t wait for the next one!"
"81b16d98-7ad6-4ae2-bc85-e457835d9e9f","Removery (Katy)","Katy","5","The assistance that was provided was exceptional!  Danielle and Kristen was awesome! They were both very welcoming and informative about the process.  They made sure the atmosphere had a positive vibe"
"78d72ae6-c8d7-494e-8bb1-a030c984b745","Removery (Katy)","Katy","5","Danielle and Kristen are the best!"
"affcd46d-21fc-4390-85c8-5d49dc61287e","Removery (Katy)","Katy","4","Update: Do not be more than 5 minutes late. They will not see you and then take a lunch break.

Danielle and Kristen were great! I’ve been putting off having my tattoos removed and I’m so happy that I moved forward with it! They made me feel comfortable during the whole process and I’m so relieved to be doing it through Removery. If you’re hesitant about removing your tattoos, don’t be! It really doesn’t hurt and it’s well worth it!"
"21a51f90-df5a-476d-9f09-d3b061a528cf","Removery (Katy)","Katy","5","I just had my 8th laser session and im loving the results from my tattoo removal procedure. My tattoo is fading slowly and there is no scaring or damage to my skin. The staff at Removery Katy is very professional making every moment comfortable as they possibly can."
"8c0edd78-1dca-4431-a75d-6680b4aba33b","Removery (Katy)","Katy","5","I have nothing but great things to say about Removery, especially the Katy location. Great service and luckily for me, I’m in and out in less than 20 seconds."
"4e1fa8d6-95b9-4d35-a06a-50bac4960ee9","Removery (Katy)","Katy","5","Very nice people Specially Danielle, she very sweet through the process with you, talks you through it 10/10 recommend. This was my first session ever getting anything like this and she made less nervous for me! 🫶🏽"
"15c31e91-b442-4214-9117-c602ac9e2383","Removery (Katy)","Katy","5","Everyone was so nice and helpful with the process. This is my first time getting a tattoo removed and they helped me through every step of the way. Like in what financing option is best for me and what to expect with each tattoo session. I’m excited to get my tattoo removed haha, they even reach out to make sure everything is good with aftercare"
"44445c80-9c8c-4053-b014-5e59951ed76b","Removery (Katy)","Katy","5","Great  people and very professional"
"64cc6913-b861-4375-86c1-16a3652b5966","Removery (Katy)","Katy","5","Great experience! Very fast procedure and they made sure you understood everything!"
"8570ddaf-d612-4b9c-898e-43a010b70105","Removery (Katy)","Katy","5","The girls at Katy removery are always very kind & accommodating!  My tattoos are fading nicely & one is almost completely gone!"
"cf3e5240-3165-4f06-a657-8e1476ce4916","Removery (Katy)","Katy","5","Danielle, Kirsten and Amanda at the katy office are always so helpful! In and out in 5 minutes every visit😄 fast and efficient"
"93baf32b-9380-4590-92cb-a22f5eb84abd","Removery (Katy)","Katy","5","Danielle and her team are amazing. Always helping me with my questions or concerns. I appreciate you all!"
"566bca5c-666f-4009-a419-770fb4e144c8","Removery (Katy)","Katy","5","Danielle is always getting me in and out super fast and is always easy going about the whole process. Great expulsion everytime I have a session here. Thanks again!"
"78ae0728-d000-400d-9807-8f17040cc566","Removery (Katy)","Katy","5","I had an amazing experience at Removery! From the moment I walked in, the staff made me feel comfortable and well-informed about the entire tattoo removal process. They took the time to explain what to expect, answered all my questions, and never made me feel rushed or pressured.

The treatments themselves were quick and much more manageable than I expected. The team is incredibly professional, knowledgeable, and genuinely cares about your results and comfort. The facility is also very clean and welcoming, which made a huge difference for me.

I’ve already started seeing great results and couldn’t be happier with my decision to come here. If you’re considering tattoo removal, I highly recommend Removery—you’ll be in great hands!"
"e23bb433-f43d-4cde-9436-f5ba624945d9","Removery (Katy)","Katy","5","I’m just beginning my tattoo removal process with Removery in Katy and I am so happy to say the least. The team here is amazing, sweet, and caring throughout the whole procedure."
"1bb75b75-9a92-4707-8b4a-1e565b7a7c9e","Removery (Katy)","Katy","5","Amazing experience. First time getting a tattoo removal they made it so knowledgeable and easy. Thank you guys."
"a64f8686-81c0-4537-9c86-43ce51969b22","Removery (Katy)","Katy","5","I am having a great experience with Removery. The staff is very professional and knowledgeable. they make the process really easy. I am only on my third session but I am excited to see the progress."
"2884e36f-1c78-4d3b-9b86-1404f066daef","Removery (Katy)","Katy","5","Just had my first session at Recovery Tattoo and it was a great experience. Super clean shop, professional staff, and the artist really pays attention to detail. They made sure I was comfortable the whole time and explained everything clearly. If the first session is any indication, this is going to turn out amazing. Highly recommend!!"
"c23decc3-1f3a-4790-9e0f-c62babf80982","Removery (Katy)","Katy","5","Absolute best place for tattoo removal!"
"d8362532-344f-4736-b071-f58d6e2aa0d6","Removery (Katy)","Katy","5","Removery is the best.  Very professional and knowledgeable.  Always flexible and willing to work with you!"
"93de7a30-bb69-4037-addc-20437df369e6","Removery (Katy)","Katy","5","I have been in the process of removing my tattoo for almost 2 years now, it is slowly but surely getting there! Every time I go in, they are attentive, fast and friendly with getting me booked for my next appointment, doing the process and informing me of what to look forward to at my next appointment. I would recommend removery to anyone looking to get something removed!"
"6c897bee-7de8-4042-a971-84d86f0026c8","Removery (Katy)","Katy","5","Amazing experience with Danielle, Kristen, and Amanda! They’re professional, kind, and have made my whole process comfortable and easy. Highly recommend!"
"c67889c0-61ac-43ee-b572-7abe8e6aedd5","Removery (Katy)","Katy","5","Welcoming experience for my first time visit. They made this process smooth for me. I was a little nervous at first until the staff uplifted me with courtesy words. Thank you!"
"cf2e2d99-5fb1-4ea7-b92a-dc3053dda731","Removery (Katy)","Katy","5","Great, professional and friendly staff!  Super clean building and quick process from start to finish- would definitely recommend!"
"6296506b-6ab2-4842-b452-acc3b0d76713","Removery (Katy)","Katy","5","Danielle and Kirsten at the Katy office has excellent customer service very knowledgeable and professional they made my first time visit so easy and comfortable"
"bdaf9251-9014-474b-bb95-835d63c07fcf","Removery (Katy)","Katy","5","All the ladies from Removery are so welcoming and are always making sure I’m doing well with my after care on my Removery laser appointments. They are always on top of it and lovely to have conversations with. Love that I picked this Removery out of the others!!!"
"d4171ce4-019b-4d65-baf1-3f1595a85a28","Removery (Katy)","Katy","5","Another good experience this visit."
"42c4ccbb-3e95-459e-b0a3-a831162d7bac","Removery (Katy)","Katy","5","I really like it here. The scheduling is right on time. Quick and easy. Super friendly service. I'm about halfway through and my tattoo is fading nicely."
"736ea57b-596c-4231-a9ec-80fc030b8ce3","Removery (Katy)","Katy","5","I had a great experience at this location, the staff is very friendly and professional! The results have been great. I highly recommend this location for anyone considering tattoo removal."
"ec599ab8-9700-4ebe-bc62-1da3d811bd06","Removery (Katy)","Katy","5","Had my consultation last Saturday. Danielle was very informative and friendly and I decided to start my tattoo removal journey the same day! The team is great and I look forward to seeing them every 6 weeks until my tatt is gone.

Session 5 is in the books! Everything has been fantastic with my sessions.

Session 7 on the books! Everything is still going well. Recovery after each session hasn't been too bad and the staff continues to be great!"
"626afa08-6444-41e8-9218-ed76263605e6","Removery (Katy)","Katy","5","Another great experience at removery Katy..... I can't remember my tech name ... That's just old age..lol .. but always a pleasure to see her... She was a one man show on Friday checking me in and doing my session I was in and out in minutes..."
"4bf03b72-178b-4763-b138-a379d2b2f8e3","Removery (Katy)","Katy","5","Decided to come to Removery after having a few sessions on my tattoo elsewhere, and wow what a difference! The staff is very kind and knowledgeable, and the actual removal process was so much quicker and less painful! Highly recommend."
"4cd67d56-8ae8-4a13-90fe-136b5d3df79a","Removery (Friendswood)","Friendswood","5","He does a really good job , works steady and informs you really well"
"a0a7ba5d-df83-4cf6-84cc-cbb6c8f9a5c7","Removery (Friendswood)","Friendswood","5","I love Removery Friendswood!"
"11b625d8-c34f-4db3-a49e-69a49e1a54ae","Removery (Friendswood)","Friendswood","5","I'm on appointment number eight
The service is always quick
The removal is not painless because it's not possible to be painless.
But they do the best they can to help mitigate that they give you an ice pack to numb the area.

The staff are friendly and always make sure to ask how your day is or what you're up to, as well as ensure that you get your next appointment scheduled without walking out that door right after your appointment absent mindedly."
"8ddf69b4-5fd9-4e07-a428-900928166a41","Removery (Friendswood)","Friendswood","5","My gf is telling me that I look bald for the first time in our relationship. Lol. Im getting tattoo removal on my entire head and DaShawn is the technician taking care of the removal. Its definitely a lengthy process but most definitely worth it. Ask for DaShawn!"
"ca170e05-1258-453f-9d2a-919d27468613","Removery (Friendswood)","Friendswood","5","The team made me feel safe and comfortable!  They explained everything before the service!  I recommend them 10 out of 10!!"
